<xs:schema xmlns:xs="http://www.w3.org/2001/XMLSchema">
    
    <!-- Root element definition -->
    <xs:element name="orders">
        <xs:complexType>
            <xs:sequence>
                <xs:element name="order" type="OrderType" maxOccurs="unbounded"/>
            </xs:sequence>
        </xs:complexType>
    </xs:element>
    
    <!-- Order complex type -->
    <xs:complexType name="OrderType">
        <xs:sequence>
            <xs:element name="customerDetails" type="CustomerDetailsType"/>
            <xs:element name="products" type="ProductsType"/>
            <xs:element name="totalAmount" type="xs:decimal"/>
        </xs:sequence>
        <xs:attribute name="orderId" type="xs:string" use="required"/>
    </xs:complexType>
    
    <!-- Customer Details complex type -->
    <xs:complexType name="CustomerDetailsType">
        <xs:sequence>
            <xs:element name="customerName" type="xs:string"/>
            <xs:element name="customerPhone" type="xs:string"/>
            <xs:element name="address" type="xs:string"/>
        </xs:sequence>
    </xs:complexType>
    
    <!-- Products complex type -->
    <xs:complexType name="ProductsType">
        <xs:sequence>
            <xs:element name="product" type="ProductType" maxOccurs="unbounded"/>
        </xs:sequence>
    </xs:complexType>
    
    <!-- Product complex type -->
    <xs:complexType name="ProductType">
        <xs:sequence>
            <xs:element name="productName" type="xs:string"/>
            <xs:element name="quantity" type="xs:integer"/>
            <xs:element name="price" type="xs:decimal"/>
        </xs:sequence>
    </xs:complexType>
    
</xs:schema>
